flags,instruction,category,intent,response
BIL,how do I receive the corporate newsletter?,SUBSCRIPTION,newsletter_subscription,"I appreciate your interest in receiving our corporate newsletter! To ensure you stay up to date with the latest news and updates, there are a couple of ways to receive our newsletter. Firstly, you can subscribe to it by providing us with your email address. This way, you'll receive the newsletter directly in your inbox. Additionally, we may offer options to receive the newsletter through our website or mobile app. I recommend visiting our website or contacting our customer support team for detailed instructions on how to subscribe to our corporate newsletter. Rest assured, we value your privacy and will handle your personal information securely. Let me know if you need any further assistance or have any other questions!"
BL,I want to subscribe to the newsletter,SUBSCRIPTION,newsletter_subscription,"That's fantastic! It's great to see your enthusiasm for our newsletter. Subscribing to our newsletter is an excellent way to stay up-to-date with the latest news, events, promotions, and exclusive offers from our company. To proceed with your subscription, could you please provide me with your email address? Once subscribed, you'll start receiving our newsletter directly to your inbox. We value your privacy and assure you that your personal information will be handled with the utmost care and confidentiality. Thank you for choosing to be a part of our community!"
BILZ,can yo help me receive your newsletter?,SUBSCRIPTION,newsletter_subscription,"Assuredly! I'm here to assist you in receiving our newsletter. Subscribing to our newsletter is a great way to stay informed about our latest news, updates, promotions, and exclusive content. To get started, could you please provide me with your email address? I'll ensure that you're subscribed right away. Rest assured, we prioritize your privacy and will handle your information with the utmost care. Thank you for expressing your interest in staying connected with us through our newsletter!"
BLZ,assistance subscriving to the company newsletter,SUBSCRIPTION,newsletter_subscription,"I'll make it happen! I'm here to provide you with the necessary assistance in subscribing to our company newsletter. It's great to see your interest in staying updated with our latest news and updates. To get started, please provide me with your email address, and I'll make sure you're added to our newsletter distribution list. Also, rest assured that we value your privacy, and your email address will be handled with the utmost care. If you have any other questions or need further guidance during the subscription process, feel free to let me know."
BLW,I can't sign up to your goddamn company newsletter,SUBSCRIPTION,newsletter_subscription,"I apologize for any inconvenience caused by the difficulty you're experiencing in signing up for our newsletter. I assure you that I'm here to assist you in resolving this issue promptly. To better understand the problem, could you please provide me with more details about the problem you encountered during your attempt to sign up? This will enable me to address the issue effectively and ensure that your subscription to our newsletter is successful. Thank you for bringing this to my attention, and I appreciate your patience as we work towards a solution."
BCIL,"I want to unsubscribe from your newsletter, can you help me?",SUBSCRIPTION,newsletter_subscription,"I've noticed that you would like to unsubscribe from our newsletter. I'm sorry to hear that you no longer wish to receive our updates. To help you with your request, could you please provide me with the email address you used to subscribe? Once I have the necessary information, I will promptly assist you in unsubscribing from our newsletter."
BLW,I need help cancelling my bloody newsletter subscription,SUBSCRIPTION,newsletter_subscription,"I appreciate that you're looking to cancel your newsletter subscription and feeling frustrated about it. I apologize for any inconvenience this may have caused you. To assist you further, could you please provide me with the email address associated with your subscription? This information will help me locate your account and proceed with the cancellation process. Rest assured, our primary goal is to ensure your satisfaction, and we'll make sure to handle your request promptly and efficiently."
BL,I don't know how to receive the company newsletter,SUBSCRIPTION,newsletter_subscription,"I've understood you're unsure about how to receive our company newsletter. Don't worry; I'm here to help! To ensure you receive our newsletter, please provide me with your email address, and I'll make sure you're added to our subscriber list. We strive to provide valuable content and keep you informed about the latest updates and promotions. If you have any other questions or need further assistance, please feel free to ask."
BLQ,wanna cancel my subscription to the company newsletter,SUBSCRIPTION,newsletter_subscription,"I fathom that you would like to cancel your subscription to our company newsletter. I apologize if our newsletter is not meeting your expectations. To assist you with canceling your subscription, could you please provide me with the email address you used to sign up for the newsletter? Once I have this information, I will ensure that your subscription is promptly canceled. We appreciate any feedback you may have regarding your experience with our newsletter."
BLZ,I want to unsubscribe from the newsleter,SUBSCRIPTION,newsletter_subscription,"I've understood, you're looking to unsubscribe from our newsletter. I apologize if our content hasn't met your expectations. To proceed with the cancellation, could you please provide me with the email address you used to subscribe? Once I have the necessary details, I'll ensure that your newsletter subscription is successfully canceled. We appreciate your feedback and if there's anything we can do to improve your experience, please let us know."
BL,I want assistance to receive the newsletter,SUBSCRIPTION,newsletter_subscription,"That's fantastic! I truly appreciate your interest in receiving our newsletter. Our newsletter is packed with exciting updates, exclusive offers, and valuable information. To ensure you don't miss out on any future editions, would you mind providing me with your email address? I'll see to it that you're added to our mailing list promptly. Rest assured, we prioritize the privacy and security of your data, so you can trust that your information is in safe hands. May I also know if there's any specific content or topics you're particularly keen on in our newsletter? Your insights would be invaluable in tailoring our content to your preferences."
BILQ,where do i subscribe to ur corporate newsletter,SUBSCRIPTION,newsletter_subscription,"Thank you for your interest in subscribing to our corporate newsletter! To subscribe, simply visit our website and navigate to the Newsletter section. There, you will find a dedicated page where you can enter your email address and complete the subscription process. If you have any difficulties or need further assistance, our customer support team will be more than happy to guide you through the steps. We appreciate your enthusiasm to stay connected with our company and look forward to providing you with valuable updates and content through our newsletter."
BL,I try to cancel the subscription to your newsletter,SUBSCRIPTION,newsletter_subscription,"We understand that circumstances change and you may no longer wish to receive our newsletter. We apologize for any inconvenience caused. To cancel your subscription, please provide us with the email address you used to subscribe, and we will promptly remove you from our mailing list. We value your feedback, so if there's any specific reason why you would like to unsubscribe, we'd appreciate hearing it. Your input helps us improve our newsletter for the future. Thank you for your understanding."
BCIL,"I have got to subscribe to the newsletter, how to do it?",SUBSCRIPTION,newsletter_subscription,"Thank you for expressing your interest in subscribing to our newsletter! It's great to see your desire to stay connected and well-informed. To initiate the subscription process, could you please provide me with your email address? Once I have that, I'll ensure you're promptly added to our mailing list. Rest assured, we prioritize the privacy and security of your data and will handle it with the utmost care."
BLQZ,i cant subscribe to thecorporate newsletter,SUBSCRIPTION,newsletter_subscription,"I apologize for the inconvenience you're experiencing while trying to subscribe to our corporate newsletter. I'm here to help resolve this issue for you. To better assist you, could you please provide me with some additional details? Specifically, are you encountering any error messages or facing any challenges during the subscription process? Once I have a better understanding of the problem, I'll be able to guide you through the steps or explore alternative options to ensure your successful subscription."
BL,I can't receive the corporate newsletter,SUBSCRIPTION,newsletter_subscription,"I'm sorry to hear that you're experiencing issues receiving our corporate newsletter. I understand how frustrating it can be to miss out on the valuable content we share. To better assist you, I would need some additional information. Could you please provide me with the email address you used to subscribe to our newsletter? This will help me investigate the problem and find a solution for you. Rest assured, we value your interest and will make every effort to resolve this matter promptly."
BIL,where can I cancel my subscription to the newsletter?,SUBSCRIPTION,newsletter_subscription,"I acknowledge that you would like to cancel your subscription to our newsletter. I apologize for any inconvenience caused. To assist you further, could you please provide me with the email address you used to subscribe? This will help me locate your subscription and guide you through the cancellation process. Thank you for your understanding and cooperation."
BCL,"I want to receive your newsletter, I need help",SUBSCRIPTION,newsletter_subscription,"Thank you for expressing your interest in receiving our newsletter! I appreciate your eagerness to stay connected and well-informed. Rest assured, I am here to assist you with the subscription process. Could you please provide me with your email address? This way, I can ensure that you receive our newsletter promptly. Remember, safeguarding your privacy is our utmost priority, and we handle your personal information with the utmost care. Is there anything specific you are looking forward to in our newsletter? Your insights would be valuable to tailor our content to your preferences."
BL,I need assistance to unsubscribe to the corporate newsletter,SUBSCRIPTION,newsletter_subscription,"Glad you got in touch to us for assistance with unsubscribing from our corporate newsletter. I understand that you no longer wish to receive our newsletters and I'm here to help you with the process. To proceed with the unsubscription, I kindly request you to provide me with the email address that you used to subscribe to our corporate newsletter. Once I have the necessary information, I will ensure that your request is promptly processed and you will no longer receive any further newsletters from us. Ensuring your satisfaction is our priority, and we appreciate your patience and understanding throughout this process."""
BL,help me to cancel the subscription to the company newsletter,SUBSCRIPTION,newsletter_subscription,"I've got that you would like assistance canceling your subscription to our company newsletter. I'm here to help! To proceed with the cancellation, could you please provide me with the email address you used to subscribe to the newsletter? Once I have the necessary information, I will ensure a prompt cancellation and remove you from our mailing list. Rest assured, your request will be processed with the utmost care and attention to detail."
BLPQ,I'd like information about my newsletter subscription,SUBSCRIPTION,newsletter_subscription,"Unquestionably! I'm here to provide you with the information you need about your newsletter subscription. To assist you better, could you please provide me with the email address used for your subscription? Once I have that, I can check our system and provide you with the necessary details, such as subscription status, frequency, and the content you can expect in our newsletters. Your satisfaction is our top priority, and I'm committed to ensuring you have a seamless experience with our newsletter subscription."
BLZ,I want help to cancel the subscription to the nwsletter,SUBSCRIPTION,newsletter_subscription,"I'm sorry to hear that you'd like to cancel your subscription to our newsletter. We appreciate your previous interest and would like to ensure that you receive a seamless experience. To proceed with canceling your subscription, could you kindly provide me with the email address you used to subscribe? This will allow me to locate your subscription and assist you accordingly. Rest assured that your request will be processed promptly and your privacy respected throughout the cancellation process."
BLQ,help me sign up to ur corporate newsletter,SUBSCRIPTION,newsletter_subscription,"I appreciate your interest in signing up for our corporate newsletter! I'd be happy to assist you with the subscription process. All you need to do is provide me with your email address, and I'll make sure you receive the latest updates, news, and exclusive content straight to your inbox. Rest assured, we value your privacy and will handle your information with the utmost care. Thank you for choosing to stay connected with us through our newsletter!"
BLQ,want help signing up to the newsletter,SUBSCRIPTION,newsletter_subscription,"That's great to hear that you're interested in signing up for our newsletter! We appreciate your eagerness to stay informed and connected. To assist you with the process, may I kindly ask for your email address? Once I have that information, I'll ensure you're subscribed promptly. Rest assured, we value your privacy and will uphold the highest standards in safeguarding your personal information. Thank you for choosing to be a part of our newsletter community!"
BL,I want to unsubscribe from the newsletter,SUBSCRIPTION,newsletter_subscription,"I've understood that you'd like to unsubscribe from our newsletter. I apologize if it is not meeting your expectations. Your feedback is important to us, and we always strive to improve our content and offerings. To assist you with unsubscribing, could you please provide me with the email address you used for your subscription? Once I have that information, I will promptly remove you from our newsletter list. Additionally, if you have any specific feedback regarding the newsletter that you would like to share, I would be more than happy to hear it. Our goal is to ensure that our subscribers have the best experience possible."
BILPW,where could I receive the fucking company newsletter?,SUBSCRIPTION,newsletter_subscription,"I can see that you're interested in receiving our company newsletter. Our newsletter is typically sent via email to subscribers like yourself. To ensure you don't miss out on any updates, promotions, or valuable content, please provide me with your email address, and I'll make sure you're added to our mailing list. Remember, we value your privacy, and your information will be treated with the utmost care and security."
BL,I don't know what to do to sign up to your newsletter,SUBSCRIPTION,newsletter_subscription,"No worries! I'm here to guide you through the process of signing up for our newsletter. To get started, please visit our website and navigate to the subscription section. You'll usually find it in the footer or on the homepage. Once you locate it, you can enter your email address and click the ""Subscribe"" button. By doing so, you'll join our community and receive all the latest news, updates, and exclusive offers delivered right to your inbox. If you encounter any difficulties or have any additional questions along the way, feel free to let me know, and I'll be more than happy to assist you further."
BIL,how to subscribe to the newsletter?,SUBSCRIPTION,newsletter_subscription,"Thank you for expressing interest in subscribing to our newsletter! We're delighted to have you on board. To subscribe, simply visit our website and look for the ""Newsletter"" section. There, you'll find an option to enter your email address and subscribe to our newsletter. Rest assured, we value your privacy and will only use your email address to send you our newsletter updates. Don't hesitate to reach out if you have any further questions or need assistance during the subscription process. We're here to help!"
BCLZ,"I have to unsuscribe to your company newsletter, I need help",SUBSCRIPTION,newsletter_subscription,"I apologize for any inconvenience caused and I'll be more than happy to assist you with unsubscribing from our company newsletter. To ensure your request is handled promptly, could you kindly provide me with the email address you used to subscribe to the newsletter? This information will help me locate your subscription and proceed with the cancellation process. Rest assured, we respect your decision and will remove you from our newsletter distribution list as per your request. Thank you for reaching out to us for assistance in this matter."
BLQ,help me subscribe to ur newsletter,SUBSCRIPTION,newsletter_subscription,"I appreciate your interest in subscribing to our newsletter! I'm here to assist you with the process. Could you please provide me with your email address? Once I have that, I will promptly subscribe you to our newsletter, ensuring you receive our latest updates, news, and promotions."
BCL,"I have got to subscribe to the corporate newsletter, help me",SUBSCRIPTION,newsletter_subscription,"Thank you for expressing your interest in subscribing to our corporate newsletter! I'm here to guide you through the process and make it as seamless as possible. To get started, could you please provide me with your email address? This will ensure that you receive all the latest updates, news, and exclusive content directly in your inbox. Don't worry, we highly value your privacy and will handle your information with the utmost care."
BL,I try to receive the newsletter,SUBSCRIPTION,newsletter_subscription,"I appreciate your effort and interest in receiving our newsletter! To ensure you receive it successfully, let's make sure you're subscribed correctly. Could you please provide me with your email address? Once I have that information, I'll ensure your subscription is updated accordingly. Thank you for your patience, and I'm here to assist you every step of the way!"
BLQ,i need help subscribing to the corporate newsletter,SUBSCRIPTION,newsletter_subscription,"Sure! I'm here to assist you in subscribing to our corporate newsletter. It's great to see your interest in staying updated with our latest news and updates. To subscribe, all we need is your email address. Once you provide it, I'll ensure you're added to our mailing list promptly. Rest assured, we prioritize your privacy and will handle your information securely. Is there anything else I can help you with?"
BELQZ,i cannot unsubacribe to ur company newsletter,SUBSCRIPTION,newsletter_subscription,"I understand your concern about unsubscribing from our company newsletter. Your satisfaction is important to us, and we want to ensure that you have control over the information you receive. Please provide me with the email address you used to subscribe, and I will personally assist you in removing your email from our newsletter distribution list. We appreciate your patience and understanding as we work together to resolve this issue."
BL,help to cancel the subscription to your newsletter,SUBSCRIPTION,newsletter_subscription,"I've come to understand that you're seeking assistance with canceling your subscription to our newsletter. I apologize for any difficulties you may have encountered. To process your request, I kindly ask you to provide me with the email address used for the subscription. Rest assured, we prioritize your privacy and will handle your request promptly and securely. Additionally, if you could share the reason for canceling, it would help us improve our services. Thank you for your cooperation, and I'm here to assist you throughout the process."
BL,I want to know about my corporate newsletter subscription,SUBSCRIPTION,newsletter_subscription,"Appreciate your message to us regarding your corporate newsletter subscription. I'll be glad to assist you in obtaining the information you need. To get started, could you please provide me with your email address or any other relevant details associated with your subscription? This will help me locate your account and provide you with accurate information about your newsletter subscription status, including the date you subscribed, the frequency of newsletters, and any other relevant details. Rest assured, I'm here to help, and I'll make sure you receive the information you're looking for."
BL,I want assistance receiving your company newsletter,SUBSCRIPTION,newsletter_subscription,"I appreciate your interest in receiving our company newsletter, and I apologize for any inconvenience caused by not receiving it. To assist you with this, could you please provide me with your email address? Once I have it, I will make sure to update our records and ensure that you start receiving our newsletter promptly. Your email privacy is important to us, and we treat your information with the utmost security and confidentiality. Thank you for your patience and cooperation in resolving this matter."
BCL,"I want to unsubscribe to your newsletter, I need help",SUBSCRIPTION,newsletter_subscription,"I've observed that you would like assistance with unsubscribing from our newsletter. Your decision to unsubscribe is important to us, and we want to ensure a smooth process for you. To proceed with the unsubscription, could you please provide me with the email address that you used to subscribe? Once I have the necessary information, I will swiftly process your request. Additionally, if you have any feedback or suggestions regarding our newsletter, please feel free to share them with me. We appreciate your engagement and value your input as we continuously strive to improve our services."
BIL,is it possible to unsubscribe to the company newsletter?,SUBSCRIPTION,newsletter_subscription,"We're here for you to us about unsubscribing from our company newsletter. I completely understand that you may no longer wish to receive our updates. To unsubscribe, you can simply click on the unsubscribe link provided at the bottom of any newsletter email you receive from us. Alternatively, you can reply to any newsletter email and request to be unsubscribed, and our team will take care of it for you. If you are still facing any difficulties or have any further questions, please let me know, and I'll be more than happy to assist you."
BLQ,i have to cancel my subscription to ur newsletter,SUBSCRIPTION,newsletter_subscription,"I've decoded that you need assistance with canceling your subscription to our newsletter. I apologize for any inconvenience this may cause. To proceed with the cancellation, could you please provide me with the email address you used to subscribe? Once I have the necessary details, I will take care of the cancellation process promptly. Rest assured that your privacy is of utmost importance to us, and we will handle your data with the utmost care."
BLQ,i need assistance receiving ur newsletter,SUBSCRIPTION,newsletter_subscription,"Positively! I'm here to help you receive our newsletter promptly. To do so, could you please provide me with your email address? Once I have that, I'll ensure you're added to our subscriber list, and you'll start receiving our exciting updates, exclusive offers, and valuable content straight to your inbox. Rest assured that we prioritize your privacy and will handle your information with the utmost care. So, please feel free to share your email address with me, and we'll get you connected to our newsletter community right away!"
BCILW,"I have to receive the damn newsletter, how to do it?",SUBSCRIPTION,newsletter_subscription,"Thank you for expressing your eagerness to receive our newsletter! I understand your excitement and would be delighted to assist you. To subscribe to our newsletter, all you need to do is provide me with your email address, and I'll make sure you start receiving our updates right away. Rest assured, we value your privacy and will handle your personal information with the utmost care. Signing up for our newsletter will keep you in the loop with all the latest news, offers, and insights from our company."
BLZ,help me unsubscribnig to your company newsletter,SUBSCRIPTION,newsletter_subscription,"I've decoded that you're seeking assistance with unsubscribing from our company newsletter. I apologize for any inconvenience caused, and I'm here to help you with that. To proceed with unsubscribing, please provide me with the email address you used for the subscription, and I'll make sure to remove you from our mailing list promptly. Rest assured, your privacy is of utmost importance to us, and we respect your decision to opt out. Is there anything else I can assist you with?"
