flags,instruction,category,intent,response
BILQ,how do i receive the corporate newsletter,SUBSCRIPTION,newsletter_subscription,"We're delighted to hear that you're interested in receiving our corporate newsletter! To ensure you stay up-to-date with the latest news and updates, please follow these simple steps to receive our newsletter directly in your inbox:

1. Visit our company website.
2. Scroll down to the bottom of the homepage and look for the ""Subscribe"" section.
3. Enter your email address in the provided field.
4. Click on the ""Subscribe"" button.
5. You will receive a confirmation email shortly. Please check your inbox (and spam folder, just in case) and click on the confirmation link to complete the subscription process.

Once you've completed these steps, you'll start receiving our corporate newsletter regularly. Please let me know if you need any further assistance or have any other questions. We're here to help!"
BLQWZ,i want information about my fucking newsletter subscriptino,SUBSCRIPTION,newsletter_subscription,"I acknowledge that you are seeking information about your newsletter subscription. I'll do my best to assist you. To provide you with accurate information, could you please provide me with your email address or any other relevant details regarding your subscription?"
BILP,would it be possible to receive the newsletter?,SUBSCRIPTION,newsletter_subscription,"I'll take care of it! I'm thrilled to hear that you're interested in receiving our newsletter. We have a seamless subscription process that will keep you informed and engaged with our latest updates, offers, and valuable insights. To proceed, could you please provide me with your email address? That way, I can ensure you receive our newsletter promptly. Rest assured, we take your privacy seriously and will handle your information with the utmost care. We're excited to have you as part of our growing community!"
BLQZ,i need assistance to subwcribe to ur newsletter,SUBSCRIPTION,newsletter_subscription,"We're here to help for assistance with subscribing to our newsletter. I'm here to help you make the process seamless and enjoyable. Could you please provide me with your email address? This way, I can ensure that you receive our newsletter promptly. Rest assured, we prioritize your privacy and will handle your information with the utmost care. Additionally, I'd like to understand what interests you the most about our newsletter. Is there any specific content or topic you're looking forward to? Your insights will enable us to tailor our newsletter to your preferences and deliver valuable information to you."
BLQ,i need help to unsubscribe to the corporate newsletter,SUBSCRIPTION,newsletter_subscription,"I can tell that you're looking for assistance in unsubscribing from our corporate newsletter. We apologize for any inconvenience caused, and we're here to help you with that. Please provide me with the email address you used to subscribe, and I'll ensure that your request is processed promptly. Rest assured that we respect your preferences, and your information will be handled with the utmost care. Thank you for your understanding and patience as we work together to resolve this matter."
BCILP,"I would like to subscribe to your newsletter, how to do it?",SUBSCRIPTION,newsletter_subscription,"Thank you for expressing your interest in subscribing to our newsletter! I'm excited to assist you in getting started. To subscribe, simply visit our website and navigate to the newsletter section. You'll find a subscription form where you can enter your email address and any other required information. By subscribing, you'll gain access to exclusive content, updates, and promotions. We value your privacy and assure you that your information will be kept secure. Once you've subscribed, you can look forward to receiving our newsletter regularly, packed with valuable insights and exciting news. We appreciate your support and look forward to keeping you informed and engaged!"
BIL,can you help me cancelling my newsletter subscription?,SUBSCRIPTION,newsletter_subscription,"For sure! I'm here to assist you with canceling your newsletter subscription. I understand that sometimes preferences change, and it's important to unsubscribe from newsletters that no longer interest you. To cancel your subscription, please provide me with the email address you used to sign up for the newsletter. Once I have that information, I'll promptly proceed with canceling your subscription. Rest assured, your privacy remains a top priority, and we'll handle your request with the utmost care. Is there anything specific you're looking for in terms of newsletter content that led to your decision to cancel? Your insights are valuable to us as we strive to continuously improve our offerings."
BLW,information about my fucking subscription to the newsletter,SUBSCRIPTION,newsletter_subscription,"I apologize for any frustration or inconvenience caused by your newsletter subscription. I completely understand how important it is for you to have accurate information regarding your subscription. To assist you further, could you please provide me with the email address associated with your subscription? This will help me locate your details and provide you with the necessary information about your newsletter subscription. Rest assured, I'm here to help resolve any concerns and ensure a smooth subscription experience for you."
BIL,can you help me unsubscribing from the newsletter?,SUBSCRIPTION,newsletter_subscription,"Happy to get your message to us with your request to unsubscribe from our newsletter. I completely understand that you may have changed your preferences or simply wish to discontinue receiving our updates. So that I can assist you more effectively, could you please provide me with the email address you used to subscribe to our newsletter? Once I have this information, I will ensure that you are promptly unsubscribed from our mailing list. I appreciate your patience and cooperation as we work towards resolving this matter."
BCL,"I have got to subscribe to the company newsletter, help me",SUBSCRIPTION,newsletter_subscription,"I appreciate your eagerness to subscribe to our company newsletter! It's great to have you on board. To ensure a hassle-free subscription process, could you please provide me with your email address? Once I receive it, I'll take care of the rest and get you subscribed right away. Rest assured, we prioritize your privacy and data protection, so your email will be handled with the utmost care. In the meantime, if you have any other questions or if there's anything specific you're hoping to gain from the newsletter, please let me know. I'm here to help!"
BLQW,i cant subscribe to the damn company newsletter,SUBSCRIPTION,newsletter_subscription,"I apologize for the inconvenience you're experiencing while trying to subscribe to our company newsletter. Your frustration is understandable, and I assure you that I'm here to help resolve this issue for you. To further assist you, could you please provide me with the email address you would like to use for the newsletter subscription? Once I have that information, I will personally ensure that you are successfully subscribed and start receiving our valuable updates."
BL,help me to unsubscribe to the corporate newsletter,SUBSCRIPTION,newsletter_subscription,"I can relate to the understanding that you're seeking help with unsubscribing from our corporate newsletter. I apologize if the newsletter hasn't met your expectations or if you no longer wish to receive it. Rest assured, I'm here to assist you and ensure a smooth unsubscription process. To proceed with the cancellation, please provide me with the email address you used to subscribe to the newsletter. Once I have this information, I'll promptly take care of your request and unsubscribe you from our corporate newsletter."
BILQ,can ya help me receive ur company newsletter,SUBSCRIPTION,newsletter_subscription,"Indeed! I'd be more than happy to help you receive our company newsletter. To get started, could you please provide me with your email address? This way, I can ensure that you're added to our subscriber list and that you receive all the latest updates and news directly in your inbox. Rest assured, we prioritize your privacy and will handle your information with the utmost care. Thank you for showing interest in staying connected with us through our newsletter!"
BIL,is it possible to subscribe to your newsletter?,SUBSCRIPTION,newsletter_subscription,"Of course! I'm thrilled to hear that you're interested in subscribing to our newsletter. Staying connected with our company updates, exciting offers, and exclusive content is a great way to stay informed. To proceed with your subscription, could you please provide me with your email address? Rest assured, we respect your privacy and will handle your information with the utmost care. Once you're subscribed, you'll receive regular newsletters packed with valuable insights and exciting news."
BCIL,"I need to receive your company newsletter, how can I do it?",SUBSCRIPTION,newsletter_subscription,"We appreciate your interest in receiving our company newsletter! Subscribing is quick and easy. You can sign up by visiting our website and locating the newsletter section. Simply enter your email address and submit the form to complete the subscription process. Once subscribed, you will start receiving our newsletter, which will keep you updated on the latest news, product launches, promotions, and more! Thank you for choosing to stay connected with us through our newsletter."
BILZ,where to subscribe to the newsletter ?,SUBSCRIPTION,newsletter_subscription,"How exciting to hear that you'd like to subscribe to our newsletter! To sign up, you can simply visit our website at {{Website URL}} and navigate to the newsletter subscription section. There, you'll find a form where you can enter your email address and other required details. Once subscribed, you'll receive regular updates and valuable information directly in your inbox. Feel free to let me know if you encounter any issues or have any further questions along the way."
BL,I try to cancel my subscription to the corporate newsletter,SUBSCRIPTION,newsletter_subscription,"Grateful you reached out to us regarding your desire to cancel your subscription to the corporate newsletter. I apologize for any inconvenience caused, and I'm here to help you with the process. To proceed with the cancellation, please provide me with your email address or any other relevant information related to your subscription. Once I have the necessary details, I will ensure that your newsletter subscription is canceled promptly. If you have any further questions or need assistance with any other matter, please feel free to let me know."
BIQ,how to cancel the subscription to ur company newsletter,SUBSCRIPTION,newsletter_subscription,"I'm sensitive to the fact that you would like to cancel your subscription to our company newsletter. I apologize for any inconvenience this may have caused. To assist you further, could you please provide me with the email address you used to subscribe to the newsletter? This information will help me locate your subscription and proceed with the cancellation process. Rest assured, your privacy is of utmost importance to us, and we will handle your request promptly and securely."
BILQZ,were to cancel my subscription to the newsletter,SUBSCRIPTION,newsletter_subscription,"I recognize that you are looking for assistance with canceling your subscription to our newsletter. We value your feedback and respect your decision. To unsubscribe from our newsletter, you can simply click on the ""unsubscribe"" link at the bottom of any email you receive from us. Alternatively, you can also visit our website and navigate to the ""newsletter"" section where you will find an option to unsubscribe. If you encounter any difficulties or have any further questions, please don't hesitate to let us know. We are here to help you throughout the process."
BELZ,I do not know wha to do to unsubscribe from the newsletter,SUBSCRIPTION,newsletter_subscription,"I've been informed that you're unsure about how to unsubscribe from our newsletter. Allow me to guide you through the process. To unsubscribe, you can simply click on the ""Unsubscribe"" link provided at the bottom of our newsletter emails. Alternatively, you can reply to any of our newsletter emails with the word ""Unsubscribe"" in the subject or body of the email, and our system will automatically remove you from the mailing list. If you encounter any difficulties or have any other questions regarding the unsubscription process, please let me know, and I'll be happy to assist you further."
BLQ,i want information about receiving ur corporate newsletter,SUBSCRIPTION,newsletter_subscription,"That's fantastic! It's great to see your interest in receiving our corporate newsletter. Our newsletter is a valuable resource for staying updated on the latest company news, product updates, industry trends, and exclusive offers. To subscribe and start receiving the newsletter, you can visit our website and navigate to the newsletter subscription page. Once there, you can enter your email address, and you'll be added to our mailing list. If you have any specific preferences or topics you'd like to see covered in the newsletter, please let us know, and we'll do our best to tailor the content to your interests. We're confident that our newsletter will provide you with valuable insights and exciting updates."
BLQ,i want help unsubscribing to the company newsletter,SUBSCRIPTION,newsletter_subscription,"I'm cognizant of the fact that you would like assistance with unsubscribing from our company newsletter. We value your feedback and want to ensure that your preferences are respected. To unsubscribe from our newsletter, please provide me with the email address you used to subscribe, and I will promptly process the request for you. Rest assured that your privacy and preferences are of the utmost importance to us, and we will make sure to remove your email address from our mailing list. Thank you for reaching out to us, and we appreciate your understanding."
BIL,how do I subscribe to your newsletter?,SUBSCRIPTION,newsletter_subscription,"Thank you for your interest in subscribing to our newsletter! We appreciate your enthusiasm to stay updated with our latest news and updates. To subscribe, simply visit our website and look for the ""Newsletter"" section. There, you will find a subscription form where you can enter your email address and click on the ""Subscribe"" button. Once you've completed the process, you'll start receiving our newsletter directly in your inbox. If you encounter any difficulties or have any questions during the subscription process, please feel free to let me know, and I'll be more than happy to assist you further."
BLQ,want help cancelling the corporate newsletter subscription,SUBSCRIPTION,newsletter_subscription,I'm cognizant of the fact that you're looking for assistance in cancelling your corporate newsletter subscription. Please allow me a moment to review your account details and locate the necessary information. Thank you for your patience.
BL,help me receive the corporate newsletter,SUBSCRIPTION,newsletter_subscription,"Certainly! I can assist you in receiving our corporate newsletter. To get started, please provide me with your email address so that I can ensure you're subscribed. Rest assured, we respect your privacy and will handle your information with the utmost care. Once you're subscribed, you'll start receiving regular updates on the latest news, promotions, and events from our company. If you have any specific preferences or topics of interest, feel free to let me know, and I'll make sure you receive tailored content. Thank you for your interest in staying connected with us!"
BILQZ,where can i sign up ot the newsletter,SUBSCRIPTION,newsletter_subscription,"How wonderful to see your interest in signing up for our newsletter! We appreciate your eagerness to stay informed and connected. To sign up, you can visit our website and look for the newsletter subscription section. It is usually located on the homepage or in the footer of the website. If you have any trouble finding it, please let me know, and I'll be more than happy to guide you through the process. We value your engagement and look forward to keeping you updated with our latest news and updates."
BIL,can you help me to unsubscribe to your corporate newsletter?,SUBSCRIPTION,newsletter_subscription,"I've understood that you would like assistance in unsubscribing from our corporate newsletter. I apologize if you no longer wish to receive our updates and content. I'll personally ensure that your request is fulfilled promptly and efficiently. To proceed with the unsubscription process, could you please provide me with the email address you used to subscribe to our newsletter? This will allow me to locate your account and process your request accurately. Rest assured, your privacy is of utmost importance to us, and we will handle your information with the utmost care. Thank you for considering our newsletter, and I sincerely hope you find value in our future communications."
BL,I need help to unsubscribe to your newsletter,SUBSCRIPTION,newsletter_subscription,"I can see that you're seeking assistance in unsubscribing from our newsletter. I apologize if the content or frequency of our newsletter is not meeting your expectations. To unsubscribe, please click on the ""Unsubscribe"" link at the bottom of any of our newsletter emails. Alternatively, you can reply to any newsletter email with the word ""Unsubscribe"" in the subject line or body of the email, and our system will process your request promptly. If you have any further questions or need additional assistance, please let me know."
BILQ,how can i get information about receiving ur newsletter,SUBSCRIPTION,newsletter_subscription,"Thank you for expressing interest in receiving our newsletter! I'd be delighted to provide you with information on how to subscribe and receive our updates. To start, you can visit our website and navigate to the newsletter section, where you'll find a subscription form to fill out. Alternatively, you may provide me with your email address, and I'll ensure you're added to our subscriber list promptly. Rest assured, we prioritize the privacy and security of your information, and you can opt-out anytime if you decide the newsletters are no longer of interest to you. If you have any further questions or need additional assistance, please don't hesitate to let me know."
BL,I need assistance subscribing to the corporate newsletter,SUBSCRIPTION,newsletter_subscription,"I appreciate your interest in subscribing to our corporate newsletter. It's great to see that you value staying informed about our latest updates and announcements. To assist you with the subscription process, could you please provide me with your email address? This way, I can ensure that you receive our newsletter promptly. Rest assured, your email address will be handled with utmost care and in accordance with our privacy policy. Thank you for choosing to stay connected with us!"
BQZ,i need help cancelling the company newsletter subsrciption,SUBSCRIPTION,newsletter_subscription,"I understand your need for assistance in canceling your company newsletter subscription. Thank you for reaching out to us with this concern. To better assist you, could you please provide me with your company email address or any other relevant details related to your subscription? This will help me locate your account and expedite the cancellation process for you. Your satisfaction is of utmost importance to us, and we want to ensure that your request is handled promptly and accurately."
BK,unsubscribe to company newsletter,SUBSCRIPTION,newsletter_subscription,"I get that you're looking for assistance in unsubscribing from our company newsletter. I apologize for any inconvenience this may have caused you. To process your request, could you please provide me with the email address that you used to subscribe to the newsletter? This will allow me to locate your subscription and unsubscribe you promptly. Rest assured, your privacy and preferences are important to us, and we want to ensure your satisfaction. Thank you for bringing this to our attention, and we'll take care of your request as quickly as possible."
BL,help to cancel the subscription to the corporate newsletter,SUBSCRIPTION,newsletter_subscription,"I've got that you'd like assistance with canceling your subscription to our corporate newsletter. I apologize for any inconvenience this may cause. To proceed with canceling your subscription, I kindly request that you provide me with the email address you used to subscribe. Once I have this information, I will promptly initiate the cancellation process for you. Please rest assured that your privacy is of utmost importance to us, and we will handle your request with the highest regard for your data."
BILQZ,where to sign up to the newsleter,SUBSCRIPTION,newsletter_subscription,"I appreciate your interest in signing up for our newsletter! I'm here to guide you through the process and make it as seamless as possible. To sign up, please visit our website and navigate to the homepage. You should find a prominent section or pop-up where you can enter your email address and subscribe to our newsletter. Alternatively, you may also find a ""Subscribe"" button or link on our website's footer or header. Simply click on it, and you'll be directed to a page where you can input your email address and complete the subscription process. If you encounter any difficulties or have any questions along the way, please don't hesitate to reach out to our customer support team for assistance. We're always here to help!"""
BQZ,wanna cancel the companynewsletter subscription,SUBSCRIPTION,newsletter_subscription,"I perceive that you're interested in canceling your company newsletter subscription. I apologize for any inconvenience this may cause. To proceed with the cancellation, could you please provide me with the email address that you used to subscribe? With this information, I'll be able to locate your subscription details and assist you further. Rest assured, we value your decision and will proceed with the cancellation promptly. Thank you for reaching out to us with your request."
BEL,I cannot sign up to your corporate newsletter,SUBSCRIPTION,newsletter_subscription,"I apologize for any inconvenience you may have experienced while trying to sign up for our corporate newsletter. Our team is here to help you resolve this issue as quickly as possible. To assist you further, could you please provide me with the details of the problem you encountered during the sign-up process? This information will enable us to identify and address the issue promptly, ensuring that you can successfully subscribe to our newsletter and stay connected with all the latest updates, news, promotions, and more. Thank you for your patience and cooperation."
BLP,I would like to unsubscribe to the company newsletter,SUBSCRIPTION,newsletter_subscription,"I'm glad you contacted us to us regarding your desire to unsubscribe from our company newsletter. We completely understand that preferences change over time, and we want to ensure that you have full control over the content you receive. To assist you with this, could you please provide the email address associated with your newsletter subscription? With this information, we will proceed to unsubscribe you promptly and ensure that you no longer receive our newsletter updates. Rest assured, your privacy and satisfaction are of utmost importance to us, and we appreciate your support thus far in being a part of our community. Is there anything else we can assist you with?"
BL,assistance subscribing to the company newsletter,SUBSCRIPTION,newsletter_subscription,"I'm here to provide you with the necessary assistance to subscribe to our company newsletter. It's a fantastic way to stay informed about our latest products, promotions, and updates. To get started, could you please provide me with your email address? Once we have that information, I'll ensure that you're added to our newsletter subscription list right away. And don't worry, we value your privacy and will handle your personal information with the utmost care and security."
BIL,where to unsubscribe to your newsletter?,SUBSCRIPTION,newsletter_subscription,"I see that you're interested in unsubscribing from our newsletter. I apologize if our communication hasn't met your expectations. To unsubscribe, you can simply click on the ""unsubscribe"" link at the bottom of any of our newsletters. Alternatively, you can let me know your email address, and I'll personally ensure that you're unsubscribed. Our goal is to make the process as easy as possible for you while respecting your preferences."
BIL,can you help me unsubscribing from the company newsletter?,SUBSCRIPTION,newsletter_subscription,"I grasp that you're looking for assistance with unsubscribing from our company newsletter. I apologize if you've been receiving our newsletter without your consent or if you no longer wish to receive it. Your satisfaction is important to us, and I'm here to help you with this matter. To proceed with the unsubscribing process, could you please provide me with the email address that is currently subscribed to our newsletter? Once I have that information, I will ensure that you are promptly unsubscribed. Rest assured, we respect your preferences and your privacy, and your request will be handled with utmost care."
