flags,instruction,category,intent,response
BLQZ,tell me about cancellling the subscription to ur newsletter,SUBSCRIPTION,newsletter_subscription,"I see that you're interested in learning about cancelling your subscription to our newsletter. I apologize if our content hasn't met your expectations or if you no longer wish to receive updates from us. To cancel your subscription, you can visit our website and navigate to the newsletter settings page. There, you'll find an option to unsubscribe or manage your subscription preferences. If you encounter any difficulties or require further assistance, please let me know, and I'll be more than happy to help you through the process. We value your feedback and appreciate the time you've spent as part of our newsletter community. Is there anything specific you'd like to know or any other concerns you'd like to address? Your insights are invaluable to us as we continuously strive to improve our services."
BL,I try to subscribe to the newsletter,SUBSCRIPTION,newsletter_subscription,"I appreciate your effort to subscribe to our newsletter! It's great to see your enthusiasm. To ensure a seamless subscription process, please visit our website at {{Website URL}} and navigate to the newsletter section. From there, you'll find a straightforward signup form where you can enter your email address and confirm your subscription. If you encounter any issues along the way or have any questions, feel free to reach out to our customer support team for immediate assistance. We're here to help make sure you don't miss out on the latest updates and exclusive offers from us!"
BL,help receiving your company newsletter,SUBSCRIPTION,newsletter_subscription,"I'm here to assist you in receiving our company newsletter effortlessly. To get started, could you please provide me with your email address? That way, I can ensure that you are subscribed to our newsletter and don't miss out on the latest updates, exclusive offers, and exciting content. Rest assured, we value your privacy and will handle your information with the utmost care. Looking forward to helping you stay connected with our newsletter!"
B,information about cancel the company newsletter subscription,SUBSCRIPTION,newsletter_subscription,"I can sense that you are seeking information regarding canceling your subscription to our company newsletter. We appreciate your interest and value your decision to evaluate your subscription preferences. To cancel your newsletter subscription, you can navigate to the email you received and locate the 'unsubscribe' link at the bottom of the email. Simply click on the link, and it will direct you to the unsubscribe page where you can confirm your cancellation. Alternatively, you can reach out to our customer support team through email or phone, and they will be happy to assist you with canceling your subscription. Please keep in mind that canceling your subscription means you won't receive any further updates from us. If you have any further questions or need additional assistance, feel free to let me know!"
BLQ,i have got to unsubscribe to ur newsletter,SUBSCRIPTION,newsletter_subscription,"I'm sensitive to the fact that you would like to unsubscribe from our newsletter. It's important to us that we respect your preferences and provide a seamless experience. To process your unsubscribe request, could you please provide me with the email address you used to subscribe? Once I have that information, I will ensure that you are promptly removed from our newsletter subscription list. If there's anything else I can assist you with, please let me know."
BILZ,can oyu help me receive the company newsletter?,SUBSCRIPTION,newsletter_subscription,"For sure! I'm glad to hear that you're interested in receiving our company newsletter. It's a fantastic way to stay updated with the latest news, updates, and promotions. To ensure you don't miss out on any valuable information, all you need to do is provide me with your email address, and I'll take care of the rest. Rest assured that we prioritize your privacy and will handle your information with the utmost care. If you have any specific preferences or topics you'd like us to cover in our newsletters, please feel free to let me know. Together, let's make sure you receive all the exciting updates and valuable content that we have to offer!"
BL,I want to know about cancelling my newsletter subscription,SUBSCRIPTION,newsletter_subscription,"I'm on it! I'm here to provide you with the information you need about canceling your newsletter subscription. Canceling is a simple process, and I'd be happy to guide you through it. Could you please provide me with the email address you used to subscribe to the newsletter? This will help me locate your subscription details and provide you with the necessary steps to cancel it. Rest assured that your privacy is of utmost importance to us, and we'll handle your request promptly and securely."
B,I need assistance to subscribe to your company newsletter,SUBSCRIPTION,newsletter_subscription,"I'll make it happen! I can assist you with subscribing to our company newsletter. We appreciate your interest in staying updated on the latest news and updates from our company. To proceed with the subscription, could you please provide me with your email address? This way, I can ensure that you receive the newsletter directly in your inbox. Rest assured that we value your privacy and will handle your information with utmost care. Once you share your email address, I'll take care of the rest and get you subscribed right away. Thank you for considering our newsletter, and we look forward to keeping you informed and engaged!"
BILP,would it be possible to sign up to the newsletter?,SUBSCRIPTION,newsletter_subscription,"Of course! We would be delighted to have you as a subscriber to our newsletter. Signing up is quick and easy. Simply visit our website and navigate to the newsletter subscription page. There, you will find a form to fill out with your name and email address. Once you submit the form, you will start receiving our newsletters directly in your inbox. If you have any further questions or need any assistance during the sign-up process, please don't hesitate to let us know. We're here to help!"
BL,I am trying to sign up to your newsletter,SUBSCRIPTION,newsletter_subscription,"How exciting to hear that you're eager to sign up for our newsletter! I'll be more than happy to assist you with the process. To get started, please provide me with your email address so that I can ensure you receive all the latest updates, news, and exclusive offers straight to your inbox. Rest assured that your privacy is of utmost importance to us, and we will handle your email address with the highest level of security and care. Thank you for choosing to stay connected with us!"
BLZ,I want to unsubscribe from thd company newsletter,SUBSCRIPTION,newsletter_subscription,"I understand your desire to unsubscribe from our company newsletter. We appreciate your honesty and value your feedback. To unsubscribe, you have a couple of options. You can click on the 'Unsubscribe' link at the bottom of any newsletter email you receive from us, and it will take you to a page where you can confirm your decision. Alternatively, you can reach out to our customer support team, and they will be more than happy to assist you with unsubscribing. Please let me know if you need any further assistance or have any other questions."
BELQZ,i do not know how to unsubscribe to ur corporate newslegter,SUBSCRIPTION,newsletter_subscription,"I've grasped that you're unsure about how to unsubscribe from our corporate newsletter. I'm here to guide you through the process. To unsubscribe, you can simply click on the ""Unsubscribe"" link at the bottom of any newsletter email you receive from us. Alternatively, you can reply to the email and request to be removed from the mailing list. If you're encountering any difficulties with the unsubscribe process, please provide me with your email address, and I'll personally ensure your removal from our newsletter distribution. We appreciate your interest in our company updates, and if there's anything else I can assist you with, please don't hesitate to let me know."
BLZ,I want help receoving the newsletter,SUBSCRIPTION,newsletter_subscription,"I appreciate your interest in receiving our newsletter! It seems you may be encountering some difficulties with receiving it. I apologize for any inconvenience caused. In order to assist you further, could you please provide me with your email address? This way, I can ensure that you are subscribed to our newsletter and receiving it without any issues. Rest assured, your privacy is of utmost importance to us, and we will handle your information with the highest level of security and care."
BL,I can't unsubscribe to your newsletter,SUBSCRIPTION,newsletter_subscription,"I'm sorry to hear that you're having trouble unsubscribing from our newsletter. I apologize for any inconvenience this may have caused. To assist you further, could you please provide me with the email address you used to subscribe to the newsletter? This will help me locate your subscription details and resolve the issue promptly. Rest assured, we are committed to meeting your needs and ensuring a hassle-free experience."
BEL,I do not know how I can receive the newsletter,SUBSCRIPTION,newsletter_subscription,"I can relate to the understanding that you're unsure about the process of receiving our newsletter. Allow me to provide you with a step-by-step guide on how to subscribe. First, you can visit our website and navigate to the newsletter subscription page. Once you're there, you'll be prompted to provide your email address. After entering your email, simply click the ""Subscribe"" button, and you'll start receiving our newsletter directly in your inbox. If you encounter any difficulties or have further questions, please don't hesitate to reach out. We're here to help you every step of the way."
BLQ,need help cancelling the newsletter subscription,SUBSCRIPTION,newsletter_subscription,"I've taken note that you're looking for assistance with canceling your newsletter subscription. I apologize for any inconvenience this may have caused. To proceed with the cancellation, please provide me with the email address you used to subscribe to our newsletter, and I'll take care of it for you right away. Rest assured, your request will be handled promptly and with the highest level of privacy and security. Thank you for bringing this to our attention, and I appreciate your patience during the process."
BLQZ,need help to cancel  my subscription to your newsletter,SUBSCRIPTION,newsletter_subscription,"I realized that you would like assistance in canceling your subscription to our newsletter. I apologize if there have been any inconveniences that have led to this decision. Our newsletters are designed to provide valuable information and updates, so if there's anything specific that has made you want to opt-out, please let me know. To proceed with the cancellation, could you please provide me with the email address that you used to subscribe to the newsletter? Once I have that information, I'll take care of canceling your subscription promptly."
BL,I don't know how I can receive your newsletter,SUBSCRIPTION,newsletter_subscription,"Thank you for reaching out! I'm here to guide you on how to receive our newsletter. To subscribe, simply visit our website and look for the ""Newsletter"" section. You'll usually find a form where you can enter your email address and submit your subscription request. Once you've subscribed, you'll start receiving our newsletter directly to your inbox, keeping you updated on the latest news, updates, and special offers. If you have any further questions or need assistance with the subscription process, feel free to let me know!"
BLQ,help me canceling my subscription to ur corporate newsletter,SUBSCRIPTION,newsletter_subscription,"I get that you're seeking assistance with canceling your subscription to our corporate newsletter. I apologize for any inconvenience caused. To cancel your subscription, could you please provide me with the email address you used to subscribe to the newsletter? Once I have this information, I will promptly proceed with canceling your subscription. We value your feedback and would appreciate it if you could share the reason behind your decision to unsubscribe. Your insights are valuable to us as we strive to improve our newsletter and tailor our content to better suit the preferences of our subscribers."
BLZ,help to unsubscribe to your newslettert,SUBSCRIPTION,newsletter_subscription,"I appreciate that you would like assistance with unsubscribing from our newsletter. I apologize if our content no longer aligns with your interests. Your feedback is valuable to us as we strive to improve our newsletter experience. To unsubscribe, please provide me with the email address that you used to subscribe, and I will promptly remove you from our mailing list. Rest assured, we respect your decision and your privacy. If there's anything else I can assist you with, please don't hesitate to let me know."
BLQ,want assistance signing up to the company newsletter,SUBSCRIPTION,newsletter_subscription,"Thank you for your interest in signing up for our company newsletter! I would be delighted to assist you with the process. To get started, could you please provide me with your email address? This way, I can ensure that you receive all the latest updates, promotions, and exciting news directly in your inbox. Rest assured that we value your privacy and will handle your information with the utmost care. Once again, thank you for choosing to stay connected with us through our newsletter!"
BCILQ,need to receive ur newsletter can ya help me,SUBSCRIPTION,newsletter_subscription,"Assuredly! I'm thrilled to hear that you're interested in receiving our newsletter. It's a great way to stay up-to-date with all the latest news, promotions, and exciting updates from our company. To get you started, could you please provide me with your email address? I'll ensure that you're added to our mailing list promptly. Rest assured, we take your privacy seriously and will handle your information with the utmost care."
BLZ,tell me about unsubscribing from your newslewtter,SUBSCRIPTION,newsletter_subscription,"I'll get right on it! I understand that you would like information on how to unsubscribe from our newsletter. We value your choice and respect your decision. To unsubscribe, you can simply click on the ""Unsubscribe"" link provided at the bottom of any newsletter email you receive from us. Alternatively, you can visit our website and navigate to the ""Newsletter Subscription"" or ""Preferences"" section, where you will find the option to unsubscribe. If you encounter any difficulties or have any further questions, please don't hesitate to let us know, and we'll be glad to assist you."
BIQ,how do i cancel the subscription to ur company newsletter,SUBSCRIPTION,newsletter_subscription,"Thank you for contacting to us about canceling your subscription to our company newsletter. I understand that you would like to opt-out from receiving our newsletters. To cancel your subscription, please provide me with the email address you used to subscribe so that I can locate your account and proceed with the cancellation. Rest assured, your privacy and preferences are of utmost importance to us, and we will promptly honor your request."
BIL,can I subscribe to the corporate newsletter?,SUBSCRIPTION,newsletter_subscription,"Certainly! We're thrilled to hear about your interest in subscribing to our corporate newsletter. It's a great way to stay updated on the latest news, promotions, and exclusive offers. To subscribe, you can visit our website and navigate to the newsletter section, where you'll find a subscription form. Simply fill in your email address and click the subscribe button. Alternatively, you can provide me with your email address, and I'll be happy to assist you with the subscription process. Rest assured, we value your privacy and adhere to strict data protection policies. Let me know how I can help you further!"
BILZ,can you help md unsubscribing to your company newsletter?,SUBSCRIPTION,newsletter_subscription,"I'll make it happen! I'm here to assist you with unsubscribing from our company newsletter. I apologize if the content didn't meet your expectations or if you no longer wish to receive updates from us. To proceed with the unsubscription, I kindly request your email address. Once I have the necessary information, I will ensure that you are promptly removed from our newsletter distribution list. Your privacy and preferences are important to us, and we respect your decision. If there's anything else I can do to improve your experience, please let me know."
BL,tell me about cancelling my company newsletter subscription,SUBSCRIPTION,newsletter_subscription,"Definitely! I understand that you would like to know more about cancelling your company newsletter subscription. Cancelling the subscription to our newsletter is a straightforward process. You can usually find an unsubscribe link at the bottom of our newsletter emails. Just click on the link, and it will guide you through the steps to cancel your subscription. Alternatively, you can also reach out to our customer support team, and they will assist you in unsubscribing from the newsletter. We value your decision and are here to support you every step of the way. If there's anything else you need assistance with, please don't hesitate to let us know!"
BILZ,were to sign up to the newsletter?,SUBSCRIPTION,newsletter_subscription,"Thank you for expressing interest in signing up for our newsletter! To subscribe, you can visit our website at {{Website URL}} and look for the newsletter sign-up form. The form usually appears on the homepage, sidebar, or footer of our website. You can provide your name and email address to complete the subscription process. We appreciate your enthusiasm, and we look forward to keeping you informed with our latest updates and promotions."
BLQ,need to unsubscribe from the newsletter,SUBSCRIPTION,newsletter_subscription,"I get that you would like to unsubscribe from our newsletter. Your decision is important to us, and we want to ensure that you have a seamless experience with us. To proceed with the unsubscribe process, could you please provide me with the email address that you used to subscribe? This information will help us locate your subscription details and promptly remove you from our mailing list. Rest assured that your privacy remains our top priority, and we appreciate the opportunity to improve our offerings based on your feedback."
BL,unsubscribing from newsletter,SUBSCRIPTION,newsletter_subscription,"I understood, you would like to unsubscribe from our newsletter. I apologize for any inconvenience this may have caused. To assist you further, could you please provide me with the email address you used to subscribe to the newsletter? This will help me locate your subscription details and proceed with the necessary steps to unsubscribe you from our mailing list. Rest assured, we respect your decision and your privacy, and we will ensure the prompt removal of your email address from our newsletter distribution. Thank you for giving us the opportunity to address your concern."
BIL,where can I unsubscribe to your company newsletter?,SUBSCRIPTION,newsletter_subscription,"Glad you got in touch to us regarding unsubscribing from our company newsletter. I completely understand that preferences and interests can change over time, and we respect your decision. To unsubscribe from our newsletter, you can click on the ""Unsubscribe"" link provided at the bottom of any newsletter email you have received from us. Alternatively, you can also visit our website and navigate to the ""Preferences"" or ""Email Subscriptions"" section, where you will find the option to unsubscribe. If you encounter any difficulties, please let me know, and I'll be more than happy to assist you further. Your satisfaction is our top priority, and we appreciate your trust and support."
BCL,"I want to cancel my subscription to your newsletter, help me",SUBSCRIPTION,newsletter_subscription,"I understand your request to cancel your newsletter subscription, and I'm here to assist you. I apologize if our newsletter no longer meets your needs. To proceed with the cancellation, please provide me with the email address that you used to subscribe to our newsletter. Once I have the necessary information, I will ensure that your subscription is promptly canceled. Please note that this action is irreversible, and you may miss out on valuable updates and exclusive offers. If there's anything specific that prompted your decision to cancel, I would appreciate hearing your feedback as it helps us improve our services."
BLQ,need help cancelling my subscription to ur newsletter,SUBSCRIPTION,newsletter_subscription,"I apologize for any inconvenience caused, and I'm here to assist you with canceling your newsletter subscription. To better assist you, could you please provide me with the email address or any other information associated with your subscription? This will help me locate your account and proceed with the cancellation process promptly. Rest assured that your request will be followed through, and you will no longer receive any further newsletters from us. If you have any questions or concerns, please don't hesitate to let me know."
BLQZ,help me  receiving ur corporate newsletter,SUBSCRIPTION,newsletter_subscription,"Certainly! I'd be more than happy to assist you in receiving our corporate newsletter. To ensure that you stay up-to-date with our latest updates, news, and promotions, please provide me with your email address, and I'll ensure that you're added to our newsletter subscription list. Rest assured, we value your privacy and will handle your information securely. Thank you for your interest in staying connected with us!"
BILQ,is it possible to cancel the newsletter subscription,SUBSCRIPTION,newsletter_subscription,"I catch on to the fact that you're looking to cancel your newsletter subscription. We value your feedback and want to ensure your experience aligns with your preferences. To proceed with the cancellation, please provide me with your email address or any other relevant information associated with your subscription. Rest assured, we'll expedite the cancellation process promptly and respect your decision."
BIL,where do I unsubscribe from the newsletter?,SUBSCRIPTION,newsletter_subscription,"I've ascertained that you're looking to unsubscribe from our newsletter. I apologize for any inconvenience this may have caused you. To ensure your privacy and preferences are respected, please follow these steps to unsubscribe: 1. Open our newsletter email in your inbox. 2. Scroll down to the bottom of the email. 3. Look for the ""unsubscribe"" link or button. 4. Click on the ""unsubscribe"" link or button. By following these steps, you'll be successfully unsubscribed from our newsletter. If you encounter any issues or have any further questions, please don't hesitate to reach out to our customer support team. We're always here to assist you."
BQ,i have to cancel the subscription to ur company newsletter,SUBSCRIPTION,newsletter_subscription,"I've decoded that circumstances change, and you may need to cancel your subscription to our company newsletter. I apologize for any inconvenience this may have caused. To assist you with canceling your subscription, could you please provide me with the email address that you used to subscribe? This information will help me locate your subscription details and assist you accordingly. Rest assured, we respect your decision and will promptly process your request."
BLQ,i need help to cancel the newsletter subscription,SUBSCRIPTION,newsletter_subscription,"I grasp that you require assistance in canceling your newsletter subscription. Rest assured, I'm here to guide you through the process. To proceed with the cancellation, could you please provide me with the email address that you used to subscribe to our newsletter? This information will help me locate your subscription details and ensure a smooth cancellation experience for you. Thank you for reaching out to us, and I appreciate your patience as we work together to address your request."
BILQZ,what do i have to do to unsubscribe to the nrwsletter,SUBSCRIPTION,newsletter_subscription,"I've grasped that you're looking for guidance on unsubscribing from our newsletter. To unsubscribe, you can simply click on the ""Unsubscribe"" link provided at the bottom of any newsletter email you receive from us. This link will direct you to a page where you can confirm your unsubscription. Alternatively, you can reach out to our customer support team, and they will assist you in unsubscribing. Please keep in mind that by unsubscribing, you will no longer receive our newsletter and miss out on valuable updates and offers. Is there anything else I can assist you with?"
BK,cancel subscription to your company newsletter,SUBSCRIPTION,newsletter_subscription,"I'm aware that you would like to cancel your subscription to our company newsletter. I apologize if the content or frequency of the newsletter did not meet your expectations. Your request will be promptly acted upon, and your subscription will be canceled. If you have any suggestions or feedback regarding our newsletter, please feel free to share it with us. We appreciate your support and hope you'll consider subscribing again in the future if our content evolves to better suit your interests."
