flags,instruction,category,intent,response
BLQZ,i try to unsubscribe to ur companu newsletter,SUBSCRIPTION,newsletter_subscription,"I can sense that you're trying to unsubscribe from our company newsletter. I apologize for any inconvenience this may have caused. To assist you further, please provide me with the email address you used to subscribe to the newsletter. Once I have the necessary details, I will promptly process your request and ensure that you no longer receive our newsletter. Your satisfaction is our top priority, and we appreciate your patience as we resolve this matter for you."
BCQZ,need to cancel the company newslettef subscription help me,SUBSCRIPTION,newsletter_subscription,"I've got that you would like to cancel your subscription to our company newsletter. I apologize for any inconvenience this may cause. To unsubscribe, please provide me with the email address you used to subscribe, and I'll ensure that your request is processed promptly. We value your feedback and would appreciate any insights you can share regarding your decision to cancel."
BILQ,how can i cancel the subscription to the company newsletter,SUBSCRIPTION,newsletter_subscription,"I'm sorry to hear that you want to cancel your subscription to our company newsletter. We value your feedback and would like to assist you in the best possible way. To cancel your subscription, please visit our website and navigate to the newsletter section. You should see an option to unsubscribe from the company newsletter. If you're unable to locate it or face any difficulties, our customer service team is available to guide you through the process. Just give us a call at {{Customer Support Phone Number}} or reach out to us through the live chat on our website at {{Website URL}}. We'll ensure that your subscription is canceled promptly. Can we assist you with anything else today?"
BIL,how do I receive your newsletter?,SUBSCRIPTION,newsletter_subscription,"I'm delighted to see your interest in receiving our newsletter! Subscribing to our newsletter is easy. Simply visit our website and navigate to the newsletter section. You'll find a form where you can enter your email address to subscribe. By subscribing, you'll stay up-to-date with the latest news, updates, and exclusive offers from our company. We value your privacy, and you can trust that your personal information will be handled with the utmost care. Let me know if you need any further assistance with the subscription process."
BLZ,I have got to subscrie to the company newsletter,SUBSCRIPTION,newsletter_subscription,"That's fantastic! We appreciate your enthusiasm for our company newsletter. To subscribe, simply provide us with your email address, and we'll ensure you receive all the latest updates, promotions, and valuable content. Rest assured, your privacy is our utmost priority, and we handle your information with the utmost care and security. Thank you for choosing to stay connected with us through our newsletter!"
BLZ,I try tro subscribe to the newsletter,SUBSCRIPTION,newsletter_subscription,"We appreciate your initiative to subscribe to our newsletter! I apologize if you encountered any difficulties during the process. To assist you further, could you please provide me with the email address you used when attempting to subscribe? This way, I can investigate the issue and ensure that your subscription is successfully processed. Thank you for bringing this to our attention, and I'll do my best to resolve it promptly."
BLQ,information about canceling my subscription to ur newsletter,SUBSCRIPTION,newsletter_subscription,"We appreciate your interest in canceling your subscription to our newsletter. To better assist you, could you please provide us with the email address that you used to subscribe? This will allow us to locate your account and proceed with the cancellation process. We value your feedback, and if there's anything specific that prompted your decision to unsubscribe, we'd love to hear it. Your insights will help us improve our newsletter and enhance the experience for our subscribers."
BL,I want help to sign up to your corporate newsletter,SUBSCRIPTION,newsletter_subscription,"Thanks for dropping us a line and expressing your interest in signing up for our corporate newsletter! We're excited to have you join our community and stay updated on all the latest news and updates. To get started with the subscription process, please provide us with the email address you'd like to use for receiving the newsletter. Rest assured, we value your privacy and ensure that your information will be treated with the highest level of security. Once you've subscribed, you can expect to receive regular newsletters packed with valuable content, offers, and exclusive updates tailored to your interests. We truly appreciate your decision to be a part of our newsletter family, and we look forward to keeping you informed and engaged!"
BL,I need information about subscribing to your newsletter,SUBSCRIPTION,newsletter_subscription,"Thank you for your interest in subscribing to our newsletter! It's a great way to stay updated about our latest news, offers, and promotions. To subscribe, all you need to do is provide us with your email address. You can expect to receive our newsletter directly in your inbox on a regular basis. We value your privacy, and you can rest assured that we handle your personal information with the utmost care and security. If you have any further questions or need assistance with the subscription process, please don't hesitate to let me know."
BELQZ,i cannot subscribe to the newsltter,SUBSCRIPTION,newsletter_subscription,"I'm sorry to hear that you're experiencing difficulties subscribing to our newsletter. I would be more than happy to assist you with the subscription process. Could you please provide me with your email address so that I can manually add you to our newsletter list? Additionally, if you could let me know the specific issues you encountered while trying to subscribe, I'll do my best to address and resolve them for you. Thank you for bringing this to our attention, and we appreciate your patience."
BL,I need assistance unsubscribing to the newsletter,SUBSCRIPTION,newsletter_subscription,"I can tell that you would like help with unsubscribing from our newsletter. We truly value your preferences, and if you no longer wish to receive our updates, we are more than happy to assist you in canceling your subscription. To proceed, could you please provide me with the email address you used to sign up for the newsletter? This will allow us to locate your subscription details and unsubscribe you from our mailing list promptly. Rest assured, your request for unsubscribing will be handled with utmost care and your privacy will be respected throughout the process."
BL,I can't unsubscribe from your company newsletter,SUBSCRIPTION,newsletter_subscription,"I'm sorry to hear that you're having trouble unsubscribing from our company newsletter. I understand how important it is to have control over the emails you receive. Could you please provide me with your email address so that I can assist you further? Rest assured, once I have your email address, I'll do everything I can to ensure your unsubscribe request is processed promptly."
BIL,how can I find information about my newsletter subscription?,SUBSCRIPTION,newsletter_subscription,"Thank you for reaching out! I completely understand your need to gather information about your newsletter subscription. To assist you, I recommend checking your email inbox for any past newsletters or subscription confirmation emails. You can also visit our website and navigate to the newsletter section, where you may find details about your subscription status and preferences. In addition, our customer support team is always available to provide any specific information or address any concerns you may have regarding your newsletter subscription. Please feel free to reach out to them through live chat or email. We value your interest in staying informed, and we are here to support you every step of the way!"
BELQZ,i do not know what  i need to do to receive the newsletter,SUBSCRIPTION,newsletter_subscription,"I've understood, you're uncertain about the steps to receive our newsletter. Allow me to guide you through the process. To start, you can visit our website and look for the ""Newsletter"" section. From there, you will find a subscription form where you can provide your email address and opt-in to receive our newsletter. If you need any further assistance or encounter any difficulties, please don't hesitate to reach out. We're here to help!"
BL,I am trying to unsubscribe from your company newsletter,SUBSCRIPTION,newsletter_subscription,"I realized you are trying to unsubscribe from our company newsletter. I apologize if the subscription has not been meeting your expectations. To assist you with this, could you please provide me with your email address so that I can quickly locate your subscription details and proceed with the unsubscribe process? Rest assured, your privacy is of utmost importance to us, and we will ensure that your request is handled promptly and that you will no longer receive our newsletter."
BEL,I do not know how to subscribe to the newsletter,SUBSCRIPTION,newsletter_subscription,"I appreciate your honesty in expressing that you're unsure how to subscribe to our newsletter. I'm here to help you through the process and ensure that you don't miss out on any valuable updates. To subscribe, simply visit our website and navigate to the newsletter subscription section. You'll find a form where you can enter your email address to sign up. If you encounter any difficulties or need further assistance, please don't hesitate to let me know."
BLQZ,need assistance subscribing tp the newsletter,SUBSCRIPTION,newsletter_subscription,"That's great to hear that you're interested in subscribing to our newsletter! I'm here to assist you every step of the way. To expedite the process, could you please provide me with your email address? Once I have that information, I'll ensure you're subscribed to our newsletter promptly. Rest assured, we respect your privacy and will handle your data with utmost care. Is there anything specific you're looking forward to in our newsletter? Your insights are valuable to us as we strive to provide you with relevant and engaging content."
BLQZ,help me cancel my subscriptiopn to ur newsletter,SUBSCRIPTION,newsletter_subscription,"I apologize if the newsletter hasn't met your expectations. I understand that you would like to cancel your subscription, and I'm here to assist you with that. Could you please provide me with the email address you used to subscribe to our newsletter? Once I have this information, I will promptly remove your email from our subscription list. We value your feedback, so if there's anything specific you didn't like about the newsletter, please let us know. We are always looking for ways to improve our content and deliver a better experience to our subscribers."
BL,help me canceling my subscription to the newsletter,SUBSCRIPTION,newsletter_subscription,"I can see that you're looking for assistance with canceling your subscription to our newsletter. I apologize for any inconvenience caused and I'm here to help you. To proceed with the cancellation, could you please provide me with the email address that you used to subscribe to the newsletter? Once I have the necessary information, I will ensure that your subscription is canceled promptly."
BL,I try to unsubscribe to your company newsletter,SUBSCRIPTION,newsletter_subscription,"I've got that you would like to unsubscribe from our company newsletter, and I apologize for any inconvenience caused. I want to reassure you that your request will be promptly addressed. To assist you further, could you kindly provide me with the email address you used to subscribe to our newsletter? This will help me locate your subscription details and ensure a seamless and accurate unsubscribe process. Thank you for your cooperation, and I appreciate your understanding."
BL,I want help cancelling my corporate newsletter subscription,SUBSCRIPTION,newsletter_subscription,"I've picked up that you're looking to cancel your subscription to our corporate newsletter. I apologize for any inconvenience this may cause. To assist you with canceling your subscription, I kindly request your name, email address, or any other relevant information associated with your subscription. Once I have the necessary details, I will promptly process your request. We appreciate your past interest in our newsletter, and if there's anything else we can assist you with, please let us know."
BIL,how do I subscribe to the corporate newsletter?,SUBSCRIPTION,newsletter_subscription,"We appreciate your interest in subscribing to our corporate newsletter! To stay updated with the latest news, promotions, and exclusive content, all you need to do is provide us with your email address. You can do this by visiting our website and navigating to the newsletter subscription section. Once there, simply enter your email address in the designated field and click on the ""Subscribe"" button. By following these steps, you'll be added to our mailing list and start receiving our newsletter directly in your inbox. If you have any other questions or need further assistance, please don't hesitate to let me know!"
BLQ,i have to unsubscribe to ur corporate newsletter,SUBSCRIPTION,newsletter_subscription,"I've understood, you have the need to unsubscribe from our corporate newsletter. We value your choice and want to ensure that you receive only the content that aligns with your interests. To proceed with your unsubscribe request, could you please provide me with the email address that you used to subscribe? Rest assured, your privacy is of utmost importance to us, and we will promptly remove you from our newsletter list. Additionally, if there's any specific feedback or reason behind your decision, we would appreciate hearing it as it helps us improve our content and offerings."
BL,I can't see the status of my subscription to your newsletter,SUBSCRIPTION,newsletter_subscription,"I'm sorry to hear that you're having trouble viewing the status of your newsletter subscription. I completely understand that you would like to have visibility on this matter. To assist you further, could you please provide me with the email address you used to subscribe to our newsletter? Once I have this information, I'll investigate and provide you with an update on the status of your subscription. Rest assured, we value your interest in our newsletter, and I'll do my best to get this resolved for you."
BCLZ,"I have tounsubscribe from the newsletter, help me",SUBSCRIPTION,newsletter_subscription,"I've been informed that you're looking for assistance with unsubscribing from our newsletter. I apologize for any inconvenience this may have caused you. To proceed, could you please provide me with the email address that you used to subscribe to the newsletter? Once I have the necessary information, I will expedite the unsubscription process for you. Rest assured, your privacy is of utmost importance to us, and we will handle your request with the highest regard."
BLQ,wanna know about cancelling the newsletter subscription,SUBSCRIPTION,newsletter_subscription,"I've ascertained that you're interested in learning about canceling your newsletter subscription. We value your choice and respect your decision. To cancel your subscription, you can simply click on the ""unsubscribe"" link provided at the bottom of any newsletter you receive from us. Alternatively, you can reach out to our customer support team, and they will be happy to assist you in canceling your subscription. Please keep in mind that it may take a few days for the cancellation to take effect. If there's any specific reason you're considering canceling, I'd appreciate hearing your feedback. We're always working to improve our newsletter and would love to address any concerns you may have."
BCLQWZ,wanna subscribe to the bloody ndwsletter help me,SUBSCRIPTION,newsletter_subscription,"That's fantastic to hear that you're interested in subscribing to our newsletter! I'm here to assist you with the subscription process. To get you started, could you please provide me with your email address? This way, I can ensure that you receive our latest updates, promotions, and exclusive content directly in your inbox. Rest assured, we prioritize your privacy and will handle your information with the utmost care. Feel free to let me know if you have any questions or if there's anything else I can assist you with."
BELZ,I cannot subscribe to youir newsletter,SUBSCRIPTION,newsletter_subscription,"I apologize for the inconvenience you're experiencing while trying to subscribe to our newsletter. I understand how frustrating it can be when you encounter difficulties with the subscription process. To assist you better, could you please provide me with more details about the issue you're facing? This will help me identify the problem and find a suitable solution for you. Rest assured, your satisfaction is our top priority, and we'll work together to resolve this matter promptly."
BLW,I am trying to sign up to your fucking newsletter,SUBSCRIPTION,newsletter_subscription,"Thank you for expressing your interest in signing up for our newsletter. I apologize if there was any inappropriate language in the previous exchange. To subscribe to our newsletter, please provide me with your email address, and I will ensure you are included in our mailing list. Rest assured, we value your privacy and will handle your information with the utmost care. We look forward to delivering informative and engaging content directly to your inbox."
BLQ,find information about my subscription to ur newsletter,SUBSCRIPTION,newsletter_subscription,"I would be more than happy to assist you in finding information about your subscription to our newsletter. To better assist you, could you please provide me with the email address you used to subscribe? This will help me locate your subscription details and provide you with the necessary information. Rest assured, your privacy is of utmost importance to us, and I will handle your personal information with the highest level of care and confidentiality."
BCLPQZ,I'd like to unsubscrie to the corporate newsletter help me,SUBSCRIPTION,newsletter_subscription,"I certainly recognize your desire to unsubscribe from our corporate newsletter. Your satisfaction is of utmost importance to us, and we want to ensure that our content aligns with your preferences. To assist you in the process, could you please provide me with the email address that you used to subscribe to the newsletter? This information will help us locate your subscription in our system and promptly initiate the cancellation. Rest assured that your privacy is highly valued, and we will handle your request with the utmost care. Thank you for reaching out to us, and we appreciate your understanding as we work to resolve this matter for you."
BLQWZ,help unsubscribing from ur damnnewsletter,SUBSCRIPTION,newsletter_subscription,"I'm sorry to hear that you're having trouble unsubscribing from our newsletter. Please accept my sincere apologies for any inconvenience caused. I understand that you no longer wish to receive our newsletter, and I'll do my best to assist you. Could you please provide me with the email address you used to subscribe to the newsletter? Once I have this information, I'll promptly unsubscribe you from our mailing list. Thank you for bringing this to our attention, and I appreciate your patience as we resolve this matter."
BILQ,where can i sign up to the corporate newsletter,SUBSCRIPTION,newsletter_subscription,"I'll make it happen! I appreciate your interest in signing up for our corporate newsletter. To subscribe, please visit our website's homepage and scroll down to the bottom. You will find a section where you can enter your email address and click on the ""Sign up"" button. Alternatively, you may also find a ""Subscribe"" button at the top or bottom of any page on our website. By clicking on that button, you will be directed to a page where you can provide your email address for newsletter registration. We highly value your decision to stay updated with our latest news and updates, and we welcome you to be a part of our corporate community. If you encounter any difficulties during the process or have any further questions, please don't hesitate to let me know!"
BL,assistance to unsubscribe from the company newsletter,SUBSCRIPTION,newsletter_subscription,"Absolutely! I'm here to provide the assistance you need to unsubscribe from our company newsletter. I understand that preferences change over time, and it's important to have control over the information you receive. To begin the unsubscribe process, could you please provide me with the email address you used to subscribe to the newsletter? Once I have that information, I will promptly take care of your request. Your satisfaction is our top priority, and we appreciate your trust in us."
BILW,can I sign up to the damn newsletter?,SUBSCRIPTION,newsletter_subscription,"Certainly! I appreciate your interest in signing up for our newsletter. It's a great way to stay updated with the latest news, offers, and exclusive content from our company. To subscribe, please provide me with your email address, and I'll ensure you receive our newsletter promptly. Rest assured, we value your privacy and will handle your data with the utmost care."
BLP,I would like to cancel the subscription to the newsletter,SUBSCRIPTION,newsletter_subscription,"I've realized that you would like to cancel your subscription to our newsletter. I apologize if our content did not meet your expectations. Your feedback is valuable to us, and we always strive to improve our services. To assist you further, could you please provide the email address you used for the subscription? Once we have the necessary information, we will promptly process your request and ensure that you are unsubscribed from our newsletter."
BCL,"I have to subscribe to the newsletter, I need help",SUBSCRIPTION,newsletter_subscription,I'm here to assist you with subscribing to our newsletter! It's great to see your interest in staying updated with the latest news and promotions from our company. I can guide you through the process step by step and ensure your subscription is set up successfully. Let's get started!
BELQZ,i do not know how i can unubscribe to the newsletter,SUBSCRIPTION,newsletter_subscription,"I've been informed that you're uncertain about the process to unsubscribe from our newsletter. It's essential to have control over the content you receive, and we're here to assist you with that. To unsubscribe, you can simply click on the ""Unsubscribe"" link provided at the bottom of the newsletter email. Alternatively, you can reach out to our customer support team through the contact information available on our website, and they will be more than happy to assist you with the unsubscription process. We value your feedback, so if there's any particular reason you wish to unsubscribe, please let us know, as your insights are valuable in improving our services."
BLQ,i want assistance to cancel the newsletter subscription,SUBSCRIPTION,newsletter_subscription,"I understood that you would like assistance with canceling your subscription to our newsletter. I apologize for any inconvenience this may cause. To proceed with the cancellation, could you please provide me with the email address associated with your newsletter subscription? This will help me locate your account and ensure a swift and accurate cancellation process. Rest assured, we value your privacy and will handle your request with the utmost care and confidentiality. Thank you for reaching out to us for assistance with this matter."
BLQ,assistance cancelling the subscription to ur newsletter,SUBSCRIPTION,newsletter_subscription,"I catch on to the fact that you would like assistance with canceling your subscription to our newsletter. I apologize if our content didn't meet your expectations or if you no longer wish to receive updates from us. To proceed with cancellation, please provide me with the email address you used to subscribe, and I'll ensure your request is processed promptly. We appreciate your feedback and value your decision. If there's anything else I can assist you with, please let me know."
BILQWZ,can i cancel the bloody usbscription to ur newsletter,SUBSCRIPTION,newsletter_subscription,"I'm on it! I understand that you would like to cancel your subscription to our newsletter. I apologize if you've had any negative experiences or frustrations with it. I assure you that we value your feedback and take your request seriously. To proceed with the cancellation, could you please provide me with the email address you used to subscribe? This will allow us to locate your subscription and process the cancellation promptly. Thank you for giving us the opportunity to assist you with this matter."
BL,find information about my newsletter subscription,SUBSCRIPTION,newsletter_subscription,"I'll get right on it! I understand that you would like to find information about your newsletter subscription. To assist you efficiently, could you please provide me with the email address associated with your subscription? With that information, I'll be able to quickly access your subscription details and provide you with the necessary information."
